source_id,source_path,role,notes
phase2_speciation_reference_points,analyses/phase2/activity_epcsaft/data/processed/phase2_speciation_reference_points.csv,processed_reference_input,Measured true-species speciation targets plotted as markers.
phase2_speciation_target_roles,analyses/phase2/activity_epcsaft/data/processed/phase2_speciation_target_roles.csv,target_role_input,Separates direct positive targets from reported-zero upper bounds and balance-inferred context rows.
phase2_speciation_activity_curves,analyses/phase2/activity_epcsaft/data/processed/phase2_speciation_activity_curves.csv,native_solver_curve_input,Continuous curves generated only from native ePC-SAFT solver-success rows.
phase2_solver_diagnostics,analyses/phase2/activity_epcsaft/data/processed/phase2_solver_diagnostics.csv,solver_gate_input,Records solver success for each plotted activity-equilibrium state.
phase2_residual_acceptance_audit,analyses/phase2/activity_epcsaft/data/processed/phase2_residual_acceptance_audit.csv,claim_gate_input,Controls validation and manuscript claim permission without changing model-run status.
