target_id,source_key,source_path,target_path,target_kind,status,package_dependency,required_before_use,notes
Wong2015_Raman_speciation,Wong2015,docs/papers/md/Wong et al. - 2015 - Chemical speciation of CO2 absorption in aqueous monoethanolamine investigated by in situ Raman spec.md,data/reference/MEA/ChEq/Wong_2015_Raman_speciation.csv,data,figure_digitized_with_qa_overlay,none,yes,Digitized Fig. 8 into Wong_2015_Raman_speciation.csv with calibration metadata and QA overlay; five overlap-sensitive rows are flagged ambiguous.
Wong2015_Raman_metadata,Wong2015,docs/papers/md/Wong et al. - 2015 - Chemical speciation of CO2 absorption in aqueous monoethanolamine investigated by in situ Raman spec.md,data/reference/MEA/ChEq/Wong_2015_Raman_metadata.csv,metadata,metadata_extracted,none,yes,Recorded source/status metadata for Raman speciation extraction.
Amundsen2009_density_viscosity,Amundsen2009,docs/papers/md/Amundsen et al. - 2009 - Density and viscosity of monoethanolamine + water + carbon dioxide from (25 to 80) °C.md,data/reference/MEA/density_viscosity/Amundsen_2009_density_viscosity.csv,data,partial_extracted_unloaded_binary_tables,none,yes,Extracted clear unloaded MEA-water density Table 1 and viscosity Table 5; loaded tables remain for a later table-specific pass.
Amundsen2009_correlation_metadata,Amundsen2009,docs/papers/md/Amundsen and Dag - 2009 - APPENDIX A  PARAMETER CORRELATIONS.md,data/reference/MEA/density_viscosity/Amundsen_2009_correlation_metadata.csv,metadata,metadata_extracted,none,no,Staged correlation provenance; not a substitute for measured data.
MEA_H2O_dielectric,MEA_H2O_dielectric,data/reference/MEA/dielectric/README.md,data/reference/MEA/dielectric/MEA_H2O_dielectric.csv,data,source_lead_only,none,yes,Do not fill without repo-local table/correlation or user-approved source.
loaded_MEA_pH,loaded_MEA_pH,data/reference/MEA/pH/README.md,data/reference/MEA/pH/loaded_MEA_pH.csv,data,source_pending,none,no,Do not web search or fill without user approval or supplied source.
direct_ionic_activity,direct_ionic_activity,data/reference/MEA/ionic_activity/README.md,data/reference/MEA/ionic_activity/direct_ionic_activity.csv,data,source_pending,none,no,Do not treat analog salts as direct MEACOO- evidence unless explicitly labeled.
Fan2009_NMR_speciation,Fan2009,external DOI 10.1021/ie8015895; HERO https://hero.epa.gov/reference/7449893/,data/reference/MEA/ChEq/Fan_2009_NMR_speciation.csv,data,external_fulltext_required,none,yes,Do not fill from abstract. Acquire paper or SI and verify table/figure basis before import or digitization.
DuPreez2019_FTIR_speciation,DuPreez2019,external DOI 10.1021/acs.iecr.8b04437; ACS https://pubs.acs.org/doi/10.1021/acs.iecr.8b04437,data/reference/MEA/ChEq/DuPreez_2019_FTIR_speciation.csv,data,external_fulltext_required,none,yes,Do not fill from snippets. Acquire paper/SI and prefer tables over figure digitization if available.
