item_id,category,component_or_pair,association_scheme,m,sigma_A,epsilon_K,kappa_AB,epsilon_AB_K,k_ij,source_key,status,phase1_role,notes
MEA_2B,pure_parameter_option,MEA,2B,3.0353,3.0435,277.174,0.03747,2586.3,,Baygi2015,documented_not_selected,historical association-screening option,Retained repo neutral parity still uses the inherited 2B molecular row for continuity checks.
MEA_3B,pure_parameter_option,MEA,3B,4.5354,2.6019,204.0438,0.118488,2383.4744,,Baygi2015,selected_phase1_literature_choice,historical Smith-Missen baseline association scheme,Baygi 2015 selected 3B MEA together with 4C water for the neutral PC-SAFT baseline.
MEA_4C,pure_parameter_option,MEA,4C,4.5208,2.6574,237.6864,0.187533,989.8984,,Baygi2015,documented_not_selected,historical association-screening option,Documented as a Baygi 2015 screening option but not the selected MEA scheme.
H2O_2B,pure_parameter_option,H2O,2B,1.9599,2.362,279.42,0.175,2059.28,,Diamantonis2011_via_Baygi2015,documented_not_selected,historical association-screening option,Included because Baygi 2015 screened both 2B and 4C water options against MEA-H2O VLE.
H2O_4C,pure_parameter_option,H2O,4C,2.1945,2.229,141.66,0.2039,1804.17,,Diamantonis2011_via_Baygi2015,selected_phase1_literature_choice,historical Smith-Missen baseline association scheme,Baygi 2015 selected 4C water together with 3B MEA for the neutral baseline.
CO2_nonassociating,pure_parameter_option,CO2,nonassociating,2.0729,2.7852,169.21,,,,Gross2001_via_Baygi2015,selected_phase1_literature_choice,neutral EOS component,The Phase 1 baseline inherits the nonassociating CO2 row used in Baygi 2015 and the retained repo baseline.
MEA_H2O_binary_selected,binary_interaction_choice,MEA-H2O,MEA 3B / H2O 4C,,,,,,-0.052,Baygi2015,selected_phase1_literature_choice,binary neutral validation basis,Baygi 2015 Table 3 identified k_ij=-0.0520 as the best MEA-H2O binary choice for the selected 3B/4C association scheme pair.
MEA_H2O_binary_repo_retained,binary_interaction_choice,MEA-H2O,retained repo neutral parity,,,,,,-0.18,src/MEA/epcsaft_neutral/parameters.py,retained_repo_baseline,neutral parity continuity check,The retained repo neutral parity workflow keeps the inherited MEA-H2O k_ij row so the translation check remains comparable to the historical local baseline.
